yo_p_0719.wav	Màá wá káàdì ìdánimọ̀ tàbí káàdì orúkọ ìtẹ̀mọ́ra obìnrin kan tí mo fẹ́ràn, màá tẹjú mọ́ọ dáadáa
yo_p_0720.wav	Màá gba gbogbo orúkọ ẹ̀ sínú mi, màá wá gba díẹ̀ lára ẹ̀ wá fún ara tèmi nìkan.
yo_p_0721.wav	Báwo ló ṣe máa ń rí na? Rárá, kò tiẹ̀ lè ṣẹlẹ̀.
yo_p_0722.wav	Ọwọ́ mi ò yá báyẹn, mi ò sì ní lè jí nǹkan tó jẹ́ tọmọ ẹlòmìíràn.
yo_p_0723.wav	Nǹkan ọ̀hún ìbáà jẹ́ oun tí kò ṣeé rí dìmú. Jíjalè sì jẹ́ oun tó lòdì sófin.
yo_p_0724.wav	Ìfẹ́ alágídí, ìdánìkanwà àìlópin.
yo_p_0725.wav	Láti ìgbà yẹn, ìgbàkúùgbà tí mo bá tẹ́tí sí orin ni mo máa ń rántí ìgbésí ayé ìnàkí yẹn.
yo_p_0726.wav	Ìnàkí nínú àjà ìlé ìtura àlàpà kan, tó daṣọ tẹ́ẹ́rẹ́ bora, tó sì sùn.
yo_p_0727.wav	Màá sì máa rántí àwọn ìpanu ibẹ̀ tí a gbádùn nígbà tí à ń mu ọtíi bíà papọ̀.
yo_p_0728.wav	Mi ò tíì rí obìnrin arẹwà atọ́kùn ìwé ìròyìn arìnrìnàjò mi yen mọ́ láti ọjọ́ yìí.
yo_p_0729.wav	Mo ṣá rò pé ìṣẹ̀lẹ̀ yìí kò fún-un ní ìdààmú púpọ̀ kankan rárá.
yo_p_0730.wav	Òun àti àwọn àbúrò o ẹ̀ kò ṣáà lẹ́bi kankan níbẹ̀.
yo_p_0731.wav	Òun kọ́ ló fa èyíkéyìí gbogbo nǹkan tó ṣẹlẹ̀ sí wa lọ́sàán àná.
yo_p_0732.wav	Ó máa ń mú inú mi bàjẹ́ ṣá, ṣùgbọ́n mi ò lè mú ara mi wá látí sọ fún-un
yo_p_0733.wav	Bí àlá ni gbogbo ẹ̀ ṣe bẹ̀rẹ̀: ìyá mi ṣí ilẹ́kùn, wọ́n sì wọlé.
yo_p_0734.wav	Mo ṣẹ̀ṣẹ̀ nà sórí ibùsùn láti sùn ni nígbàtí ẹ̀yìn ojú mi bẹ̀rẹ̀ sí ta mí gidi.
yo_p_0735.wav	Mo lajú, mo sì rí àwọn èèyàn yìí, tí mo fẹ́ràn rí, tí wọ́n ti fi mí sílẹ̀ nígbà pípẹ́ sẹ́yìn.
yo_p_0736.wav	Ìyá mi jókòó sí apá ọ̀tún mi. Adémọ́lá fara pẹ́ mi lẹ́gbẹ̀ẹ́ òsì.
yo_p_0737.wav	Ìgbà ò tíì yí wọn padà tàbí sún wọn kì rárá.
yo_p_0738.wav	Èmi wà ní ìbẹ̀rẹ̀ ọgọ́ta ọdún, ṣùgbọ́n Àyọ̀ní rí bí ọmọ ọdún mẹ́rìndínlógún.
yo_p_0739.wav	Ó sì tún ń wọ aṣọ aláwọ̀ ọ búlù tí mo ti máa ń fi ṣe yẹ̀yẹ́ pé ó fún-un ní àyà.
yo_p_0740.wav	Ìyá mi rí gẹ́gẹ́ bí wọ́n ṣe rí nígbà tí wọ́n kú ní ogún ọdún sẹ́yìn.
yo_p_0741.wav	Ńṣe ló dàbí ẹni pé wọ́n fò jáde nínúu fọ́tò kan tí a yà nígbà èwe mi ni
yo_p_0742.wav	Àwọn méjèèjì nínú aṣọ tí mo dámọ̀ látẹ̀yìnwá.
yo_p_0743.wav	Irun ìyá mi wà ní kíká lókè bí wọ́n ṣe máa ń ṣùú yẹn.
yo_p_0744.wav	Ìka rẹ̀ gùn ó sì rí tínrín bí ilá. Ìgbọ̀nrìrì mú mi.
yo_p_0745.wav	Àwọn ọwọ́ yìí ni wọ́n ti kàn mí lára. 
yo_p_0746.wav	Àwọn ọwọ́ yìí ni wọ́n ti fìgbà kan nu omijé mi nù.
yo_p_0747.wav	Ṣèyí àti màmá ràn mí lọ́wọ́ kúrò lórí ibùsùn, ìkọ̀ọ̀kan ń mú mi dání ní àpá kọ̀ọ̀kan
yo_p_0748.wav	Àwọn mẹ́tẹ̀èta sì ń rìn lẹ̀ngbẹ̀ sínú u oòrùn àárọ̀ tó ṣebí ọ̀lẹ.
yo_p_0749.wav	Ojú ọjọ́ ń rùn bíi ilẹ̀ tútù tí a wú jáde, ó sì tutu pẹ̀lú ìrì àṣẹ̀ṣẹ̀rọ̀.
yo_p_0750.wav	Ọ̀kẹ́rẹ́ kan sáré kọjá lórí ọgbà mi
yo_p_0751.wav	Ẹyẹ kan bà sórí igi gúrọ́fà tó wà lẹ́gbẹ̀ẹ́ mi níbẹ̀ yẹn.
yo_p_0752.wav	Ó ń kọrin pẹ̀lú ohùn tó tobi.
yo_p_0753.wav	Etí ì mi ò kọbiara púpọ̀ tó bẹ́ẹ̀ sí kíkọrin yìí
yo_p_0754.wav	Báyìí ni gbogbo ohun tí ó ń dún ṣe mú létíì mi tó
yo_p_0755.wav	A jókòó lóríi àpótí tí ọmọ ọ̀dọ̀ mi ti gbé sẹ́gbẹ̀ẹ́ ilẹ̀kùn
yo_p_0756.wav	Ọmọ yẹn ṣá ti kọ́ bí wọ́n ṣe ń gbálẹ́ báyìí, ó sì nawọ́ sí àgbàlá.
yo_p_0757.wav	Igi ọwọ̀ tí Adédàmọ́lá fi ń gbálẹ̀ ń fi ààmì wọ́gọwọ̀gọ sílẹ̀ lórí ilẹ̀ iyẹ̀pẹ̀.
yo_p_0758.wav	Ìyá mi pòṣé ó sì kùn lábẹ́nú. Ó ní. Ọkàn mi.
yo_p_0759.wav	Ohun tí Babalájé ma ń pè mí nígbà tí mo wà ní kékeré tí a jẹ́ kòríkòsùn ni
yo_p_0760.wav	Ó máa ń fún ìyá à mi ní ìnira; bóyá nítorí bí Bámgbóṣé ṣe máa ń sọ ọ̀rọ̀ yẹn ni
yo_p_0761.wav	Ohùn rẹ̀ rí bíi ẹ̀fẹ̀ àti agbára iná lẹ́ẹ̀kannáà.
yo_p_0762.wav	Mi ò wá lè ṣe àìkọbiarasí pé kiní yìí ò wá rí bí àlá mọ́.
yo_p_0763.wav	Lákọ̀ọ́kọ́, mo wà lórí ìjókòó, ohun tí mi ò tíì lè ṣe láti bí oṣù púpọ̀ sẹ́yìn
yo_p_0764.wav	Láti ìgbà tí ẹsẹ̀ mi ti kùnà, tí a sì ti dá mi kulẹ̀ sóri ibùsùn.
yo_p_0765.wav	Àti pé, báwo ni Olúmorótì ṣe lè mọ̀ nípa àwọn ọjọ́ tí Kúnlé ti lò pẹ̀lú mi?
yo_p_0766.wav	Ọmọ ọ̀dọ̀ yìí ṣẹ̀ṣè dé láti wá gbé pẹ̀lú mi lọ́dún kẹta sẹ́yìn ni.
yo_p_0767.wav	Mo kọjú sí ìyá mi.
yo_p_0768.wav	“Láti ìgbà wo l’ẹ̀yin méjèèjì ti wà níbi?” mo bèèrè.
yo_p_0769.wav	Mo bẹ̀rẹ̀ sí ní sọ̀rọ̀ ṣùgbọ́n lẹ́yìn ìgbà yẹ ni Túndé gbé garawa omi kọ̀rọ̀ nílẹ̀.
yo_p_0770.wav	Kò kí wa, kò tiẹ̀ kọbiara sí ìdúró o wa.
yo_p_0771.wav	Mo kíyèsíi pé ìbẹ̀rẹ̀ ìbínú ti ń mú ọwọ́ mi gbọ̀n.
yo_p_0772.wav	Irú ọmọ Òṣogbo wo ní ń rìn kọjá lẹ́gbẹ̀ẹ́ àwọn tó jùú lọ nírú ọ̀nà báyìí?
yo_p_0773.wav	“Fi ọmọ yẹn sílẹ̀,” Mo gbọ́ tó sọ, bí ó tilẹ̀ jẹ́ pé kò lanu ẹ̀ láti sọ̀rọ̀.
yo_p_0774.wav	Ìyá mi wò wá, wo àwọn ìka wa tí a lọ́ papọ̀.
yo_p_0775.wav	Ètè wọn di fífẹ́lẹ́, kùrukùru dúdú sì bẹ̀rẹ̀ sí pé jọ nínú ojú wọn.
yo_p_0776.wav	Nínú ojú yìí, mo sì rí àwọn ohun ìrántí tí mo gbé sínú u ibi ìfìrántí.
yo_p_0777.wav	Èmi gẹ́gẹ́ bíi ọmọbìnrin kékeré tó ń bẹ̀ wọ́n láti fọwọ́ sí ìbáṣepọ̀ mi pẹ̀lú Ṣadé
yo_p_0778.wav	Wọ́n ti rí Tolú gẹ́gẹ́ bí a ti ń wo ológbò sí àpẹrẹ ẹja
yo_p_0779.wav	Ṣùgbọ́n Ṣeun ò kọbiara sí àìfọwọ́sí yìí; 
yo_p_0780.wav	Agídí ìgbàgbọ́ ẹ̀ ti fọ́ọ lójú;
yo_p_0781.wav	Èmi naà ò tilẹ̀ níran nítorí agídí tí mo fi so mọ́ ìbáṣepọ̀ náà.
yo_p_0782.wav	A so mọ́ ara wa bíi ẹran sí egungun.
yo_p_0783.wav	Ṣùgbọ́n ìgbà tó yá, mo pé ọmọ ọdún mẹ́rìndínlógún
yo_p_0784.wav	Ọkùnrin kan bá yọ sí ẹnu ọ̀nà ilé e wa — ọkùnrin tí ìyá mi ti ṣètò fún mi
yo_p_0785.wav	Nígbà ti mo lọ sí ilé ẹ̀, ìyá ẹ sọ pé ó ti lọ́kọ ní kánmọ́, ó sì ti kó lọ sínú ìlú pẹ̀lú ẹ̀.
yo_p_0786.wav	Ìyá mi ti gbìyànjú láti tù mí nínú ṣùgbọ́n kò sí ohun tó yé mi mọ́, oúnjẹ ò sì ládùn mọ́.
yo_p_0787.wav	Mo fẹ́ẹ̀ lè má sọ̀rọ̀ mọ́ lẹ́yìn tí Motúnráyọ̀ ti lọ.
yo_p_0788.wav	Mi ò tiẹ̀ kúrò nínú yàrá à mi rárá.
yo_p_0789.wav	Àwọn kan tiẹ̀ sọ pé bóyá mo ti ya wèrè ni.
yo_p_0790.wav	Ojú mi ti sún kì sínú ihò wọn, àti ikunmú sí ẹ̀yìn ìbàdí mi.
yo_p_0791.wav	Ọwọ́ àti ẹsẹ mi ti tínrín di bíi ọmọ ọwọ̀, aṣọ mi sì dúró mọ́ mi lára bíi àpò gàrí.
yo_p_0792.wav	Ìyá mi mọ̀ pé wọ́n lè sọ èso kan ṣoṣo tó fi ìdí wọn múlẹ̀ sí inú ilé ọkọ wọn nù.
yo_p_0793.wav	Wọ́n mọ̀ pé àwọn ìyekan bàbá mi á ṣùrù bò wọ́n àti àwọn ohun ìní bàbá à mi.
yo_p_0794.wav	Nítorí náà, wọ́n yára ṣe ìgbéyàwó o pàjáwìrì mìíràn.
yo_p_0795.wav	Ó ti sú mi, mi ò sì ṣe agídí lérò yìí.
yo_p_0796.wav	Ìbáṣepọ̀ pẹ̀lú ìyá à mi súnkì bí ohun ọ̀gbìn tí òǹgbẹ ń gbẹ.
yo_p_0797.wav	A ní àwọn ìjíròrò ọlọ́wọ̀ ní àwọn ọdún tó kọjá sẹ́yìn
yo_p_0798.wav	Ọ̀gbun tó wà láàárín wa bẹ̀rẹ̀ sí fẹ̀ síi, ó sì ń gbé gbogbo ìfẹ́ tí a ní sí ara wa mì.
yo_p_0799.wav	Nígbà tó yá, lọ́jọ́ kan, wọ́n lọ sùn, wọn kò sí jí mọ́. 
yo_p_0800.wav	Èyí jẹ́ ogójì ọdún àti márùún sẹ́yìn
yo_p_0801.wav	A jókòó síbẹ̀ nínú ìdákẹ́jẹ́ẹ́, a sì ń tẹ́tísí ìró àwọn ìyá a àdúgbò bí wọ́n ṣe ń pariwo
yo_p_0802.wav	A ń tẹ́tísí ẹ̀rín àwọn ọmọdé bí wọ́n ṣe ń sáré kọjá lẹ́gbẹ̀gbẹ́
yo_p_0803.wav	Fún ìgbà díẹ̀, kò sí ẹni tó sọ nǹkankan.
yo_p_0804.wav	Látijọ́, ìyá à mi á ti máa pariwo pé kí Òrìsàbùnmi jáde.
yo_p_0805.wav	Mo ti sọ fún ẹ, mi ò fẹ́ ọmọ ẹlẹ́nu rírùn yẹn nínú ilé mi
yo_p_0806.wav	Wọ́n á ti sọ fún mi, ṣùgbọ́n Fábùnmi ò ní kọbiara sí èébú náà.
yo_p_0807.wav	Láti ìgbà wo lẹ̀yin méjèèjì ti wà níbẹ̀yẹn?
yo_p_0808.wav	Báwo ni ẹ ti ṣe wà níbíyìí pẹ̀lúù mi ná?
yo_p_0809.wav	Mo rán wọn létí pé ní ọdún kẹta ni a wà, àti pé mo jẹ́ ọmọ ọdún méjìlélọ́gọ́ta
yo_p_0810.wav	Àwọn èèyàn kìí wọ irun wọn ní ṣùkú mọ́ tàbí kun ètè wọn ní aró.
yo_p_0811.wav	Mo ka gbogbo ohun tí ó n ṣẹlẹ̀ láyé òde òní sílẹ̀ bíi oníròyín tẹ́rù ń bà.
yo_p_0812.wav	Ìyá à mi gbá ọwọ́ mi tó ń gbọ̀n mú.
yo_p_0813.wav	Fọwọ́ kan mí lójú, Ìyá à mi sọ, wọ́n sì fi ọwọ́ méjì sí ẹ̀ẹ̀kẹ́ẹ wọn.
yo_p_0814.wav	O ti wà níbí pẹ̀lúu wa báyìí.
yo_p_0815.wav	Fún ìṣẹ́jú díẹ̀, mi ò lè sọ̀rọ̀.
yo_p_0816.wav	Tófúnmi sọ pé òún wà níbẹ̀ nígbà tí mo bí àwọn ọmọ mi obìnrin méjì
yo_p_0817.wav	Nígbàtí àwọn ọmọbìnrin yìí lọ́kọ tí wọ́n sì kó lọ bá wọn.
yo_p_0818.wav	Ó ní òun ò kúrò lẹ́gbẹ̀ẹ́ mi, pé òun ti ń dúró de ọjọ́ yìí tí màá lè fi ojú rí òun.
yo_p_0819.wav	Òòyì í bẹ̀rẹ̀ sí kọ́ mí. Ọkàn mi ti wà nínú ìpòrurù àìmọ̀kan tẹ́lẹ̀
yo_p_0820.wav	Ṣùgbọ́n nísìnyí, mo wá ń làkàkà pẹ̀lú ìran òtítọ́ tuntun ni.
yo_p_0821.wav	Gbogbo ara ẹ̀ pátápátá ni ó hunjọ tí irun funfun arúgbó sì dà bòó
yo_p_0822.wav	Àwọn ẹsẹ̀ mi tó ti wà ní kíkú tẹ́lẹ̀ ni ó ti wá ní àwọn ààmì dúdú káàkiri.
yo_p_0823.wav	Ṣùgbọ́n mi ò wá tún máa mí túpetúpe pẹ̀lú ìrora
yo_p_0824.wav	Mo sì ríi pé mo le gbé àwọn ẹsẹ̀ mi láìní wàhálà.
yo_p_0825.wav	Mo ń níran iyẹ̀pẹ̀ bíi yangan tó ń yí mi ní gìgísẹ̀.
yo_p_0826.wav	Mo ti ń dúró de ọjọ́ yìí, ọkàn mi, ó sọ, ó sì gbé orí ẹ̀ lé èjìká mi.
yo_p_0827.wav	Ó bẹ̀rẹ̀ sí ń tẹ èjìká mi jẹ́jẹ́, mo sì rí ìbẹ̀rẹ̀ ìbàlẹ̀ ọ̀kàn tó sodo sínú ikùn mi.
yo_p_0828.wav	Mo so apá mi kan mọ́ọ lọ́rùn, mo sì dì mọ́ọ síbẹ̀.
yo_p_0829.wav	Ìyá mi náà, tí kìí dùn mọ́ nínú láti rí kí ara wa kanra, dúró, wọ́n sì rìn lọ pẹ̀lú pípòṣé
yo_p_0830.wav	Sálúbàtà wọn dún pà-pà-pà lábẹ́ ẹsẹ̀ẹ wọn.
yo_p_0831.wav	Ìrántí ìgbà kékeré kan tún wá sí mi lọ́kàn pẹ̀lú ọ̀rẹ́ mi
yo_p_0832.wav	Mo ń sunkún nínú yàrá mi lẹ́yìn tí wọ́n lé Motúnráyọ̀ lọ tí wọ́n sì tì mí mọ́nú ilé.
yo_p_0833.wav	Ìbínú ńlá gba inú mi kọjá. Ìjì ráńpẹ́ kan gbọn amọ̀ ilẹ̀ pupa sókè.
yo_p_0834.wav	Tí o bá rí bí inú Ìyá mi ò ṣe dùn, kò fi hàn.
yo_p_0835.wav	Wọ́n ti tì wá mọ́ ibí láti iye ọdún yìí sẹ́yìn wá.
yo_p_0836.wav	Ó sọọ́ pẹ̀lú àìbìkítà, àfi bíi wípé ọ̀rọ̀ ẹ̀yìn-ayé jẹ́ irú ọ̀rọ̀ tí a ti fìgbà kan sọ tẹ́lẹ̀ rí.
yo_p_0837.wav	Àgbàlá pa lọ́lọ́; eruku ti baralẹ̀.
yo_p_0838.wav	Gbogbo ògiri àwọn òrùlé onírin ti àwọn ilé tó wà nítòsí ni wọ́n ti wọ àwọ̀ pupa.
yo_p_0839.wav	Ariwo agbègbè tún padà wá, gbogbo ohùn dídún orin àwọn ọ̀dọ́ àti àgbà
yo_p_0840.wav	Gbogbo dídún àwọn ohun bíi páńgolo
yo_p_0841.wav	Ẹnìkan ń kọrin ìyìn Yorùbá kan nínú ọgbà tó wà lẹ́gbẹ̀ẹ́ tẹ̀mi.
yo_p_0842.wav	Ohùn rẹ̀ kẹ̀, ó sì ń gbọ̀n, àfi bíi pé orin náà jáde wá láti inú odò ikùn ẹ̀ ni.
yo_p_0843.wav	Mo jókòó jẹ́ẹ́ sétí ìjókòó ò mi, pẹ̀lú ikùn mi tó ń kùn
yo_p_0844.wav	Mo fẹ́ sọ fún Ṣeun pé nkò mọ ohun tí màá ṣe pẹ̀lú àlàyé yìí
yo_p_0845.wav	Mi ò bìkítà fún ohun tí ó ṣẹlẹ̀ lẹ́yìn ikú, àti ibi tí màá lọ lẹ́yìn náà.
yo_p_0846.wav	Nǹkan ṣoṣo tí mo fẹ́ ni pé kí n tún ríi padà. Eléyìí ti tó fún mi.
yo_p_0847.wav	Kí ni a máa ṣe nípa wọn? Ó nawọ́ sí ibi tí ìyá mi wà.
yo_p_0848.wav	Aò le tẹ̀ síwájú láì fi tiwọn ṣe.
yo_p_0849.wav	Mo ròó fún ìgbà díẹ̀, mo wá sọ nǹkan tí mi ò tíi sọ rí nípa màmá mi.
yo_p_0850.wav	Wọn á ní láti gba ohun tí wọn ò lè yí padà lọ́tẹ̀ yìí.
yo_p_0851.wav	Mo pè sí ibi tí wọ́n jókòó sí ní igun ẹ̀yìnkùnlé. “A ní láti sọ̀rọ̀.”
yo_p_0852.wav	Ìyá mi dúró níwájú u wa, wọ́n sì yí ojú padà láti ọ̀dọ̀ mi
yo_p_0853.wav	Ohun tí ẹ̀yin méjèèjì ń ṣe yìí, èèwọ̀ ni o, Ìyá mi wí.
yo_p_0854.wav	Eléyìí bẹ̀rẹ̀ àríyànjiyàn láàárin wọn.
yo_p_0855.wav	Wọ́n ti súnmọ́ ara wọn débi pé wọ́n fẹ́ẹ̀ lè máa na ara wọn
yo_p_0856.wav	Ẹ dákẹ́ ẹnu yín kí ẹ jókòó, Màmá, ni mo pariwo, ẹnu sì ya ìyá à mi.
yo_p_0857.wav	Wọ́n wò mí bíi pé ó ti wá yé wọn pé ọjọ́ púpọ̀ ti kọjá
yo_p_0858.wav	Mi ò sì nílò láti gbà’ṣẹ lọ́wọ́ wọn mọ́. Wọ́n jókòó jẹ́jẹ́.
yo_p_0859.wav	Ó ya ìyá mi lẹ́nu bí mo ṣe sọ fún wọn pé àwọn ni wọ́n ń gbé agbedeméjì ayé òhun ọ̀run
yo_p_0860.wav	Wọ́n súnmú nígbà tí wọ́n rí ẹ̀rín músẹ́ rẹ̀.
yo_p_0861.wav	Nígbà náà ni omijé bẹ̀rẹ̀, tó ń dà sílẹ̀ pòròpòrò sí ẹ̀rẹ̀kẹ́ àti ọrùn wọn.
yo_p_0862.wav	Mi ò lè sọ bóyá ẹkún wọn jẹ́ nítorí ohun tí mo sọ tàbí ìjà a wọn pèlú Mọ́túndé
yo_p_0863.wav	“Ṣé ẹ ti ṣetán láti parí ìjà báyìí?” Mo bèèrè lọ́wọ́ wọn.
yo_p_0864.wav	“Mi ò tíì ṣetán,” Adé jágbe. Mo gbọdọ̀ sọ òótọ́ fún ẹ.”
yo_p_0865.wav	“Irú òótọ́ wo?” Mo bèèrè lọ́wọ́ ẹ
yo_p_0866.wav	Túndé tẹjú mọ́ iwájú, láìṣẹ̀tàn láti sọ ojú abẹ níkòó nípa ohun tí ìròyìn náà jẹ́.
yo_p_0867.wav	Mo wo ìyá mi; wọ́n ń wo káàkiri láiwo ibi tí mo wà.
yo_p_0868.wav	Ìyá à mi da ọwọ́ méjèèjì bojú.
yo_p_0869.wav	Wọ́n wà ní ipò yìí fún ìgbà pípẹ́, bí ẹni pé wọ́n ti ń di àpáta ni.
yo_p_0870.wav	Nígbà tí wọ́n tún wò mí, mo ríi pé ètè wọn ti ń gbọ̀n.
yo_p_0871.wav	“Ìyàwó ẹ̀ pokùnso nínú ilé ìdáná ìyá àgbà ẹ̀ l’óṣù tó tẹ̀lé ìgbéyàwó ẹ,”
yo_p_0872.wav	Mo gan pa sórí ìjókòó mi.
yo_p_0873.wav	Mo ń gbọ́ bí orí mi ti ń lagogo ju gbogbo oun mìíì tó ń dún
yo_p_0874.wav	Gbogbo iṣan nínú ara mi ni ó ti yípo ní ọ̀nà tí ó ń dùn mí gidigidi.
yo_p_0875.wav	Ojú ẹ̀ ti dà bí ẹ̀re igi, pẹ̀lú àwọn ètè .
yo_p_0876.wav	Bóyá tí màmá mi ò bá bẹ̀rẹ̀ sí ń sọ̀rọ̀ padà, m̀ bá rò pé mo ń ṣìràrán ni.
yo_p_0877.wav	Èmi àti ìyá ẹ̀ ní láti ṣe nǹkan nípa ẹ̀yin méjèèjì.
yo_p_0878.wav	Nítorínáà, a rán-an lọ sí ọ̀dọ̀ọ ìyà-àgba ẹ̀, a dẹ sọ fún un pé ó ti lọ ilé ọkọ ni.”
yo_p_0879.wav	Ó dúró láàárín ọgbà, ó ń dìmọ́ ara ẹ̀, ó kẹ̀yìn sí wa.
yo_p_0880.wav	Ó ń rí sí mi bíi pé mo ti jáa kulẹ̀ nípa gbígba àwọn irọ́ nípa ìgbéyàwó yìí gbọ́.
yo_p_0881.wav	Mo bẹ̀rẹ̀ sí lérò pé mo le fọwọ́ yí nǹkan nínú atẹ́gùn láti dá gbogbo nǹkan padà.
yo_p_0882.wav	“Mo lérò pé ẹò ni sọ pé kí n pẹ̀lẹ́ o,” Mo sọ fún màmá mi.
yo_p_0883.wav	“Nítorípé eléyìí ò ní mọ́gbọ́n wá.”
yo_p_0884.wav	“Ó ti rẹ̀ mí,” ni nǹkan ẹyọ kan tí wọ́n sọ.
yo_p_0885.wav	Mo kún fún oríṣiríṣi èrò nínú àyà mi
yo_p_0886.wav	Ìyá mi rí bí àwọ̀ omi; mo ń wò wọ́n
yo_p_0887.wav	Ṣùgbọ́n ó rí bíi pé mo tún lè rí àwọ̀ ọ̀dà tí ó wà lódìkejì lẹ́yìn wọn.
yo_p_0888.wav	Agbedeméjì ayé àti ọ̀run yìí ti sú mi.
yo_p_0889.wav	Mo dìde, mo sì rìn jáde.
yo_p_0890.wav	Ó ń fẹsẹ̀ gbá àwọn òkuta nílẹ̀ nínú àgbàlá, ó sì ń rẹ́rìín músẹ́.
yo_p_0891.wav	Ṣé o rántí ìgbà tí a máa ń yí bébà fi ṣe sìgá, tí a máa ń fàá mu lẹ́yìn ilé?
yo_p_0892.wav	Mo fọwọ́ kan ọrùn ẹ̀, mo fi ìka kan fa ìlà yíi ká, mo wò ìsàlẹ̀ láti yẹ̀ẹ́wò fún àpá.
yo_p_0893.wav	Ó dún ìdún ayọ̀ díẹ̀, ara ẹ̀ sì le lábẹ́ ìfọwọ́kàn mi.
yo_p_0894.wav	Ó gbé orí ẹ̀ lé èjìká mi.
yo_p_0895.wav	Mo da ọwọ́ mi ká gbogbo ara rẹ̀ nígbà tí mo ní ipa omijé ẹ̀ lọ́rùn mi.
yo_p_0896.wav	Àwọn ẹyẹ ti bẹ̀rẹ̀ sí kọrin láti orí igi.
yo_p_0897.wav	Èyí jẹ́ àwọn oun dídùn kan tí a gbọ́ gbẹ̀yìn kí ariwo tó dún
yo_p_0898.wav	Àwọn èrò kan bẹ̀rẹ̀ sí pé jọ.
yo_p_0899.wav	Ìyá Túndé sáré lọ sínú àgbàlá, kọjá lára wa lọ sínu ilé.
yo_p_0900.wav	Àwọn obìnrin mìí tún tẹ̀lée láìpẹ́, pẹ̀lú eruku ìdọ̀tí lẹ́yìn ìsáré e wọn.
yo_p_0901.wav	Ó mú ọwọ́ ọ̀ mi dání.
yo_p_0902.wav	Gbogbo nǹkan ló polúkúrúmuṣu báyìí, àbí bẹ́ẹ̀kọ́?
yo_p_0903.wav	Ìwọ ọ́ ṣì jẹ́ ọmọge èmi sì ti di ìyá arúgbó.
yo_p_0904.wav	Ó gbọn orí ẹ̀ nù ní rárá. “Ìwọ náà ti ń yípadà.”
yo_p_0905.wav	Mo si ríi pé àwọ ara mi ti di fífà le.
yo_p_0906.wav	Ìyá à mi dúró lẹ́nu ọ̀nà, ṣùgbọ́n mi ò kọbiara sí wọn.
yo_p_0907.wav	Gbogbo kókó ara mi ò dùn mí mọ́.
yo_p_0908.wav	Ó dà bíi pé mo ti kún fún agbára tí mi ò mọ̀ láti ìgbà pípẹ́.
yo_p_0909.wav	Ẹsẹ̀ mi sì yá fáfá nígbà ti mo wọ yàrá tí ẹgbẹ́ àwọn obìnrin ti péjọ.
yo_p_0910.wav	Màmá Ọdúnladé ń nu omijé ojú ẹ̀ pẹ̀lú etí aṣọ ìró ẹ̀.
yo_p_0911.wav	Obìnrin mìí ti já sórí ìkúnlẹ̀, lẹ́sẹ̀ ẹ ibùsùn mi.
yo_p_0912.wav	Wọn ò ṣebí ẹni pé wọ́n rí wa; kò dàbí ẹni pé wọ́n kófìrí wa.
yo_p_0913.wav	Mo wo ara à mi lórí ibùsùn, mo rí obìnrin tí mo jẹ́ nígbàkan rí.
yo_p_0914.wav	Bí ilẹ̀ ṣe máa ń rí lẹ́yìn tí ọyẹ́ bá ti mu gbogbo omi ara ẹ̀ tán.
yo_p_0915.wav	Irun ẹ̀ jẹ́ bíi ti dúdú ẹlẹ́ní bí olókùn.
yo_p_0916.wav	Ọyàn ẹ, tó pẹlẹbẹ tó sì gùn, sàn wá sílẹ̀ lẹ́gbẹ̀ẹ́ ẹ̀ mẹ́jẹ̀ẹ̀jì
yo_p_0917.wav	Obìnrin kan fa aṣọ ìbora láti bo àyà ẹ̀.
yo_p_0918.wav	Bí a ṣe kúrò ní yàrá yẹn, mo wo inú u jígí kékeré kan tí mo ní.
yo_p_0919.wav	Èyí sì fi àwòrán mi hàn bí mo ṣe rí gẹ́gẹ́ bí ọmọbìnrin ìkòkó
yo_p_0920.wav	Mo wo Ṣadé, ṣùgbọ́n ó rẹ́rìín múṣẹ́ lọ́nà tó yà mí lẹ́nu púpọ̀.
yo_p_0921.wav	Àwọn ìyá ti fún wa ní ààyè lati tún bẹ̀rẹ̀ níbi tí a ti dádúró.
yo_p_0922.wav	Ó dì mí lọ́wọ́ mú, a sì jọ jáde lọ síta.
yo_p_0923.wav	Ó jẹ́ àsìkò tí àwọn òdòdó àárọ̀ ti wà ní oge ẹwà a wọn.
yo_p_0924.wav	Mo ṣí ọwọ́ mi méjì síta, Ṣadé sì súnmọ́ iwájú.
yo_p_0925.wav	Ìdìmọ́ra wa pẹ́ púpọ̀, tí ara àwa méjèjì ń balẹ̀ sínú ara wọn.
yo_p_0926.wav	Ìyá à mi súnmọ́ wa, wọ́n káwọ́ gbera, wọ́n sì tún tú u ká.
yo_p_0927.wav	Mo mọ̀ láti gbogbo bí wọ́n ṣe ń gbọ̀n.
yo_p_0928.wav	Kò tiẹ̀ rẹ́rìín tàbí kọbiara sí ìdúró ìyá à mi níbẹ̀.
yo_p_0929.wav	Ṣùgbọ́n mo mọ̀ pé ìbínú ẹ̀ jẹ́ èyí tí mo lè mú wálẹ̀
yo_p_0930.wav	Mo ti dé ibí lákòótán, èmi sì ni kọ́kọ́rọ́ sí ilẹ̀kùun ẹ̀.
yo_p_0931.wav	“Sé ẹ ti ṣetán láti tẹ̀síwájú?” Mo bèèrè lọwọ́ ọ wọn.
yo_p_0932.wav	Ìbéèrè yìí ò tiẹ̀ wúlò mọ́ lásìkò yìí. Síbẹ̀, wọ́n ní, “Bẹ́ẹ̀ni.”
yo_p_0933.wav	Nígbà tí mo lá ojú ù mi padà, a ń dúró níwájú odò.
yo_p_0934.wav	“Tọọ̀, báwo la ṣe máa pe àwọn ìyá wá o?” Mo bi wọ́n.
yo_p_0935.wav	“Àá kọrin ni,” ìyá mi fèsì. Wọ́n sì gbóhùn sókè.
yo_p_0936.wav	Ó gbé agbohùn fóònù sókè, ó sì dìímú digbí
yo_p_0937.wav	Òun ló máa dúro fún àsìkò díẹ̀ kó tó sọ̀rọ̀.
yo_p_0938.wav	Ó ríi pé òun máa ń fẹ́ ṣeé ní àwọn ìgbà tí kò ròtì.
yo_p_0939.wav	Dípò ìyẹn, ó gbé agbohùn fóònù sílẹ̀, tí ọwọ́ ẹ̀ sì ń gbọ̀n.
yo_p_0940.wav	Ilé kan wà tó dúró bí ahá: bíi òkúra dúdú fafa
yo_p_0941.wav	Obìnrin náà tó ga, tó wunilójú tó dàbí ará ayé mìíràn
yo_p_0942.wav	Ó tún àwọn ọ̀rọ̀ yìí sọ sókè, ó ń gbádùn bí wọ́n ṣé ń yí lórí ahọ́n ẹ̀
yo_p_0943.wav	Ó sáré lọ sínú yàrá màmá ẹ̀, ó ṣí àwọn àpótí i aṣojúlóge ẹ̀.
yo_p_0944.wav	Ó ń wá nǹkan láàárín àwọn ìtọ́tẹ̀, ó ń pòṣé.
yo_p_0945.wav	Ó ṣí àpótí aṣọ ẹ̀ pẹ̀lú agídí, àwọn dígí inú ẹ̀ ṣì sọọ́ di púpọ̀ lẹ́sẹ̀kẹsẹ̀
yo_p_0946.wav	Oyin kan pẹ̀lú ẹnu pupa bí ẹ̀rọ panápaná ń léfòó nínú ìtànná ariwo ẹ̀lẹ́tíríìkì.
yo_p_0947.wav	Nínú ìjókòó ẹ̀yìn, ó le rí orí ojú ẹ̀ nínú dígí ìwẹ̀yìn ọkọ̀
yo_p_0948.wav	Ó rì lọ sínú àga bí ìlú náà ṣé ń jáde wá
yo_p_0949.wav	Ó tẹ fèrèsé ọkọ̀ sílẹ̀ bí awakọ̀ ṣe ń sọ̀rọ̀ láìdúró
yo_p_0950.wav	Ó dijú ẹ̀, tí gbogbo bótòbótò awakọ̀ náà ń wọ̀ọ́ lára láìjanpata.
yo_p_0951.wav	Níbi iṣẹ́ kìnní yìí, ó rí ọkùnrin pẹ́lẹ́ngẹ́ onígòlójú kan
