yo_p_2280.wav	Ní kété tí ìsẹ̀lẹ̀ náà wáyé ní ọjọ́ kéjìlélógún oṣù kejì ọdún tó kọjá, ni wọ́n dé.
yo_p_2281.wav	Ọ̀gágun Táyé Ajíbọ́dẹ ti ṣe àbẹ̀wò sí ikọ̀ náà ní Olúyọ̀lé.
yo_p_2282.wav	Ẹ jọ̀ọ́ ẹ bá wa bí àwọn mínísítà orílẹ̀ èdè yìí pé ibo lọ́ tí ń rí owó?
yo_p_2283.wav	Ààrẹ tuntun tí a yàn sípò ní láti yan àwọn mínísítà mìíràn.
yo_p_2284.wav	Babátúndé Fáṣolá nìkan ni mínísítà tó dá yàtò nínú gbogbo àwọn mínísítà orílẹ̀ èdè yìí.
yo_p_2285.wav	Ipò tí wọ́n yan Babátúndé Fásholá sí, a rí ipa rẹ̀ lórílẹ̀ èdè yìí.
yo_p_2286.wav	Wíwá orísirísi ìlànà fún ìtọ́jú ojú pópó jákè-jádò orílẹ̀ èdè Nàìjíríà ló jẹ wá lógún.
yo_p_2287.wav	Díẹ̀ nínu ojú pópó ní Nàìjíríà ó lè gbóúnjẹ-fẹ́gbẹ́ gbàwo bọ̀ lọ́dọọdún.
yo_p_2288.wav	Mínísítà sọ̀rọ̀ yìí ní lásìkò ètò àyẹ̀wò iṣẹ́ ojú pópó ní ìpínlẹ̀ Ògùn
yo_p_2289.wav	Ìdíkọ́ Oṣòdì tó wà ní ìjọba ìbílẹ̀ Agége, ni agbègbè tí ó tóbi jùlọ ní ìlú Èkó.
yo_p_2290.wav	Fáṣọlá sọ pé ìtọ́jú ojú pópó ṣe pàtàkì pàápàá jùlọ lásìkò òjò.
yo_p_2291.wav	Ojú ọ̀nà tó lọ sí ìpínlẹ̀ Èkìtì má ń fa wàhálà fún àwọn ọlọ́kọ̀ àti ènìyàn lásìkò òjò
yo_p_2292.wav	Sáńgo jẹ́ ọ̀kan lára àwọn ọ̀nà tó má ń fa wàhálà fún àwọn ọlọ́kọ̀ àti àwọn ènìyàn.
yo_p_2293.wav	Nítorí náà gbogbo ojú ọ̀nà tó máa ń fa wàhálà fún àwọn ọlọ́kọ̀ lásìkò òjò láti tún ṣe.
yo_p_2294.wav	Wọ́n tí ṣàtúnṣe sí àwọn ọ̀nà tí ó ń lọ sí Òṣògbo, Ìgbòho, Abéòkúta sí Ọ̀tà-Èkó.
yo_p_2295.wav	Ó kí àwọn agbaṣẹ́ṣe.
yo_p_2296.wav	Olùdarí ilé iṣẹ́ ìwé, Ifáyẹmí Ògúngbèmí ti ṣo iṣẹ́ di ìrọ̀rùn fún àwọn òṣìṣẹ
yo_p_2297.wav	Àwọn ìpèníjà tí a máa ń dojúkọ ni àìtètè rówó gbà lọ́wọ́ ìjọba.
yo_p_2298.wav	Ṣé ilé-iṣẹ́ náà ti ṣetán láti tètè parí isẹ́ náà lásìkò tí wọ́n bá rí owó?
yo_p_2299.wav	Àjọ elétò ìdìbò orílẹ̀ èdè Nàìjíríà ti bẹ̀rẹ̀ iṣẹ́ ni pẹrẹwu.
yo_p_2300.wav	Dáre Ajíbóyè tó jẹ́ olùdíje fún ipò gómìnà ti gba ìwé ẹ̀rí gẹ́gẹ́ bí gómìnà
yo_p_2301.wav	Nínú ìdìbò tó wáyé ní ìpínlẹ̀ Ọ̀yọ́ lọ́dún yìí ni ọ̀pọ̀ ènìyàn ti rí ṣe.
yo_p_2302.wav	Àwọn adájọ́ ti ilé-ẹjọ́ gíga tó wà l’órílẹ̀ èdè Nàìjíríà kájú òṣùwọ̀n.
yo_p_2303.wav	Dáre ti gba ìwé ẹ̀rí lọ́wọ ọ Kọmíṣánà fún àjọ arabìnrin Gbémisọ́lá Ṣófolúwẹ̀.
yo_p_2304.wav	Lọ́jọ́ Ẹtì ní ìlú Àbújá ní orílẹ̀ èdè Nàìjíríà ni àwọn àjọ àwọn òṣìṣẹ́ ti ma ń ṣe ìpàdé
yo_p_2305.wav	Sáájú ikéde ni Dáre ti mọ̀ pé òun ni gómìnà ìpínlẹ̀ náà.
yo_p_2306.wav	Alága àjọ ètò ìdìbò, ọ̀jọ̀gbọ́n Adétọ́lá Adéyẹmí, ti kéde gómìna tuntun.
yo_p_2307.wav	Dáre wá gbóṣùbà fún àjọ elétò ìdìbò àti ilé-ẹjọ́ fún iṣẹ takuntakun.
yo_p_2308.wav	Ǹjẹ́ àwọn ènìyàn le ní ìgbẹkẹ̀lé nínú ìjọba yìí?
yo_p_2309.wav	Dáre tún ní “kí Ọlọ́run wo ilẹ̀ Èkìtì sàn àti orílẹ̀ èdè Nàìjíríà lápapọ̀”
yo_p_2310.wav	Ọlọ́run ti mú wa rin ojú ọ̀nà òtítọ́ àti òdodo.
yo_p_2311.wav	Lọ́jọ́bọ̀ ní ilé-ẹjọ́ tó ga jùlọ ni ìdájọ́ ti máa wayé.
yo_p_2312.wav	Wọ́n ti yọ Adédèjì Tolúlọpẹ́ àti Ewégbèmí Àdìsá kúrò gẹ́gẹ́ bíi gómìnà ìpínlẹ̀ Ọ̀ṣun.
yo_p_2313.wav	Àwọn ẹgbẹ́ akọ́mọlédè e Yorùbá ti ilẹ̀ Nàìjíríà ti fi èrò wọn hàn.
yo_p_2314.wav	Ìlú Abẹ́kuta ni àwọn ọmọ ẹgbẹ́ akọ́mọlédè Yorùbá máa ń fi àdàgbá ètò rọ̀ sí.
yo_p_2315.wav	Ìjọba ti pinu láti maá ṣe ìrànlọ́wọ́ fún àwọn ẹgbẹ́ akọ́mọlédè.
yo_p_2316.wav	Àjọ ẹgbẹ́ akọ́mọlédè ti padà gòkè àgbà ní ilẹ̀ yìí àti ní òkè òkun.
yo_p_2317.wav	Ààrẹ ẹgbẹ́ akọ́mọlédè ti gbé àṣeyorí ilẹ̀ ẹ Yorùbá lọ ilẹ̀ òkèrè.
yo_p_2318.wav	Àwọn ètò tí yóò ṣe ọmọ ilẹ̀ ẹ Yorùbá láńfààní ni àwọn ẹgbẹ́ náà gbé wọ ilẹ̀ Nàìjíríà.
yo_p_2319.wav	Ẹgbẹ́ akọ́mọlédè ti fún àwọn ọmọ Yorùbá lókè òkun láńfààní láti sọ èdè abínibí i wọn.
yo_p_2320.wav	Ṣé wọn ti bẹ̀rẹ̀ ètò tí àwọn ẹgbẹ́ akọ́mọlédè gbé kalẹ̀?
yo_p_2321.wav	Ààrẹ ẹgbẹ́ akọ́mọlédè ti sọ fún àwọn ọmọ pé òun ti ṣe tán láti gbé èdè lárugẹ
yo_p_2322.wav	Igbákejì àrẹ ọ̀jọ̀gbọ́n Adéwùnmí ti kọ àwọn ìwé tó ṣàǹfààní fún àwọn ọmọdé.
yo_p_2323.wav	Mélòó nínú àwọn ọmọ Yorùbá tí kọ̀ gbọ́ èdè abínibí?
yo_p_2324.wav	Àwọn ìjọba tí kò fẹ́ gbé èdè abínibí i wa lárugẹ nàá ń hùwa abunú.
yo_p_2325.wav	Abunú ènìyàn nìkan ni kò ní mọ àǹfààní tó wà nínú èdè abínibí i rẹ̀.
yo_p_2326.wav	Àwọn aláwọ̀ funfun ti sọ àwọn ọmọ Yorùbá di abunú.
yo_p_2327.wav	Ẹni tó bá ni ọgbọ́n, ìmọ̀, òye nípa èdè Yorùbá, a máa kí irú ẹni bẹ́ẹ̀.
yo_p_2328.wav	Púpọ̀ nínú àwọn ọmọ Yorùbá ni wọ́n má ń ṣe bí abunú nípa fífi èdè abínibí i wọn pamọ́.
yo_p_2329.wav	Ta ni ẹni ta lè pè ní abunú ènìyàn?
yo_p_2330.wav	Ààrẹ orílẹ̀-èdè ti sọ fún gbogbo àwọn gómìnà ìpínlẹ̀ tó péjọ níbi ìpàdé náà.
yo_p_2331.wav	Bí ọlọgbọ́n àti omùgọ̀ bá sọ̀rọ̀, a máa mọ ìyàtọ̀ nítorí ọlọ́gbọ́n yóò sọ̀rọ̀ ọlọgbọ́n
yo_p_2332.wav	Ọ̀rọ̀ ọlọgbọ́n ni Kábíyèsí sọ fún àwọn ará ìlú níbi ayẹyẹ ìfinijoyè tó wáyé lọ́jọ́ Ẹtì.
yo_p_2333.wav	Ọ̀pọ̀lọpọ̀ ilé tó ń wó lẹ́nu ọjọ́ mẹ́ta yìí, kò ṣẹ̀yìn àwọn agbalékọ́.
yo_p_2334.wav	Àwọn agbalékọ́ tó wà ní ìlú Èkó má ń kọ́lé tí ò da.
yo_p_2335.wav	Taa ni ìjọba fi ẹ̀sùn ìpànìyàn kàn?
yo_p_2336.wav	Àwọn ẹlẹ́rìí tó wà níbẹ̀ nígbà tí ìṣẹ̀lẹ̀ náà ṣẹlẹ̀.
yo_p_2337.wav	Àbúrò ọkọ rẹ̀ tó pa fẹ́ tú àṣírí i rẹ̀ nípa májèlé tó fẹ́ fi sínu oúnjẹ fún ọkọ rẹ̀.
yo_p_2338.wav	Ilé ẹjọ́ ti padà dájọ́ ikú fún-un nítorí ẹni tó pa ènìyàn, pípa la ó pa irú ẹni bẹ́ẹ̀.
yo_p_2339.wav	Ọ̀jọ̀gbọ́ Àlàbá Dúrósinmí ni adájọ́ àgbà tó dá ẹjọ́ náà ní àná ọjọ́ Ajé.
yo_p_2340.wav	Ẹ̀sùn tí wọ́n fi kan Bímpé àti ọ̀rẹ́ rẹ̀ kì í ṣe òótọ́.
yo_p_2341.wav	Ṣé ìyàwó o Bọ́lájókòó ló pa àbúrọ̀ ọkọ rẹ̀?
yo_p_2342.wav	Ẹ̀sùn ìpànìyàn tí ìjọba fi kan Bímpé yìí yóó ba orúkọ ẹbí jẹ́.
yo_p_2343.wav	Àwọn ìjọba orílẹ̀ èdè e Nàìj́ríà ti ró ẹgbẹ́ Àmọ̀tẹ́kùn lágbára.
yo_p_2344.wav	Ẹgbẹ́ Àmọ̀tẹ́kùn tó wà ní ìlú Ọ̀yọ́ ti ń gbaradì láti kojú àwọn Fúlàní i daran daran.
yo_p_2345.wav	Àwọn Fúlàní i daran daran ti fi ògbójú gba ilẹ̀ ẹ wa lọ́wọ́ ọ wa.
yo_p_2346.wav	Níbi àpérò tó wáyé ní ìlú Àbújá ni ààrẹ ti ni, òun gbọdọ̀ mọ orúkọ ikọ̀ ọ jàǹdùkú.
yo_p_2347.wav	Ikú ìgbákejì i olórí àwọn Àmọ̀tẹ́kùn ò ṣẹ̀yìn àwọn Fúlàní i darandaran.
yo_p_2348.wav	Olórí àwọn Àmọ̀tẹ́kùn ní ìpínlẹ̀ Ọ̀yọ́ ti ní àwọn yóò gbẹ̀san ikú igbákejì òun.
yo_p_2349.wav	Ààrẹ Bùhárí yóò ṣe ìpàdé pẹ̀lú olórí àwọn Àmọ̀tẹ́kùn ní ọjọ́ Ajé tó ń bọ̀ yìí.
yo_p_2350.wav	Ìpínlẹ̀ Ọ̀ṣun ti bẹ̀rẹ̀ fún ìrànlọ́wọ́ àwọn Àmọ̀tẹ́kùn.
yo_p_2351.wav	Gbogbo ìpínlẹ̀ kọ̀ọ̀kan ní orílẹ̀ èdè Nàìjíríà ló nílò ìrànlọ́wọ́ àwọn ẹgbẹ́ Àmọ̀tẹ́kùn.
yo_p_2352.wav	Ta ni olórí àwọn Fúlàní i darandaran tí ó ń dààmú àwọn ọmọ ìpínlẹ̀ Ọ̀yọ́?
yo_p_2353.wav	Àwọn ẹ̀rí tí wọ́n kó wá ilé ẹjọ́ ló jẹ́ kí adájó náà pinu láti ní kò pa á.
yo_p_2354.wav	Ilè ẹjọ́ tó ga jù nílẹ̀ Nàìjíríà ni wọ́n gbé ẹjọ́ náà lọ.
yo_p_2355.wav	Ìjọba ti kàn sí àwọn ẹgbẹ́ kan láti kọ ilé gidi fún àwọn ènìyàn.
yo_p_2356.wav	Adarí àwọn agbalékọ́ ti sọ pé àwọn ìjọba gan ò ran àwọn ará ìlú lọ́wọ́ nípa ilé kíkọ́.
yo_p_2357.wav	Ẹgbẹ́ agbalékọ́ ti pinnu láti ra àwọn irinṣẹ́ ìgbàlódé fún kíkọ́ ilé tó dára fún àwọn ènìyàn.
yo_p_2358.wav	Àwọn ẹgbẹ́ agbalékọ́ ti kọ ìwé sí ìjọba láti yá àwọn ni owó láti ra irinṣẹ́ ìgbàlódé.
yo_p_2359.wav	Wọ́n ti yan adarí tuntun tí yóò máa sọjú àwọn agbalékọ́ ní orílẹ̀ èdè yìí.
yo_p_2360.wav	Ààrẹ orílẹ̀ èdè Nàìjíríà ti fẹ́ kọ́ ilé ìwòsàn fún àwọn agbègbè kan ní ìpínlẹ̀ Ọ̀yọ́.
yo_p_2361.wav	Ilé ìwọ̀sàn ọ̀hún yóò ní àwọn oríṣiríṣi irinṣẹ́ ìgbàlódé.
yo_p_2362.wav	Àwọn agbalékọ́ ti sọ fún Ààrẹ pé, orí ilẹ̀ irà ni wọ́n fẹ́ kọ́ ilé ìwòsàn náà sí.
yo_p_2363.wav	Ètò ìdìbò tí o máa wáyé láìpẹ́ yìí ní orílẹ̀ èdè Nàìjíríà yóò lágbára.
yo_p_2364.wav	Ìdìbò abẹ́lé tó wáyé lọ́jọ́ Ẹtì ni àwọn ọlọ́pàá ti mú àwọn jàǹdùkú
yo_p_2365.wav	Ààrẹ orílẹ̀ èdè ti ní òun yóò kópa nínú ètò ìdìbò gbogboògbò tí yóò wáyé
yo_p_2366.wav	Àwọn ẹgbẹ́ òṣèlú alákùkọ ti fàáké kọ́rí pé àwọn ò ní gba òfin tuntun tí ìjọba ṣẹ̀ṣẹ̀ là kalẹ̀ yìí.
yo_p_2367.wav	Ẹgbẹ́ òṣèlú onígbàálẹ̀ ti yan Túndé Jọlá gẹ́gẹ́ bí ẹni tó máa jẹ́ ààrẹ tuntun lórílẹ̀ èdè Nàìjíríà.
yo_p_2368.wav	Ọ̀jọ̀gbọ́n Aṣáájú ti sọ fún àwọn akọròyìn pé òun yóò ran ìjọba lọ́wọ́ lóri ètò ìdìbò abẹlé tó ń bọ̀.
yo_p_2369.wav	Àwọn àjọ elétò ìdìbò ti gbaradì fún ìdìbò gbogbogbò tí yóò wáyé lọ́dún tó ń bọ̀.
yo_p_2370.wav	Ọ̀jọ̀gbọ́n Aṣíwájú Ẹniọlá ní àwọn nílò ìdáábòbò tó dára fún ìdìbò gbogbogbò tó ń bọ̀ lọ́nà.
yo_p_2371.wav	Babátúndé Jọláoṣó ti jáwé olóborí níbi ètò ìdìbò abẹlé tí ẹgbẹ́ òṣèlú alákùkọ.
yo_p_2372.wav	Gómìnà ìpínlẹ̀ Òǹdó ti lọ sí ìlú Àbújá láti lọ bá Ààrẹ fún ìpàdé.
yo_p_2373.wav	Àwọn ilé ìgbìmọ̀ aṣòfin ti pe àkíyèsí Ààrẹ sí ìṣẹ̀lẹ̀ tó ṣẹlẹ̀ ní ìlú Ọ̀yọ́.
yo_p_2374.wav	Gómìnà ìpìnlẹ́ Ọ̀yọ́ ti lọ sí ilé ìgbìmọ̀ aṣòfin láti mọ bí àwọn òṣìṣẹ́ ṣe ń ṣiṣẹ́.
yo_p_2375.wav	Iṣẹ́ takun takun ni àwọn olùkọ́ ní ìpínlẹ̀ Ọ̀yọ́ má ń ṣe lóri àwọn akẹ́kọ̀ọ́.
yo_p_2376.wav	Olùkọ́ àgbà ní ìpínlẹ̀ Ọ̀yọ́ ti sín àwọn òbí ní gbẹ́rẹ́ ìpàkọ́ lóri àwọn ọmọ wọn.
yo_p_2377.wav	Ìṣẹ̀lẹ̀ tó ń ṣẹlẹ̀ ní ìlú Ìbàdàn ti mú kí àwọn ìgbìmọ̀ aṣòfin pe Ààrẹ Bùhárí sí àkíyèsí.
yo_p_2378.wav	Gómìnà ìpínlẹ̀ Ọ̀yọ́ ti ní òun yóò pèsè ẹ̀kọ́ ọ̀fẹ́ fún àwọn akẹ́kọ̀ọ́ ní ìpínlẹ̀ òhun.
yo_p_2379.wav	Ìlú Ìbàdàn ní agbègbè Olúyọ̀lé ni wọ́n ti gbé ètò ìlèra ọ̀hún kalẹ̀.
yo_p_2380.wav	Wọ́n ti ní kí àwọn olùkọ́ ní ìpínlẹ̀ Ọ̀yọ́ ó daṣẹ́ sílẹ̀.
yo_p_2381.wav	Ní ìpínlẹ̀ Èkìtì ni Ààrẹ ilẹ̀ Nàìjíríà fẹ́ kọ́ ilé ẹ̀kọ̀ ti ìjọ̀ba sí.
yo_p_2382.wav	Kí ni orúkọ ilé ẹ̀kọ́ tuntun tí Ààrẹ Bùhárí ṣẹ̀ṣẹ̀ kọ́ sí ìpínlẹ̀ Èkìtì?
yo_p_2383.wav	Akọ́nimọ̀ọ́gbá àwọn agbábọ́ọ̀lù ilẹ̀ Nàìjíríà ti fi ọ̀kan ààrẹ Bùhárí balẹ̀ pé àwọn yóò gba ife ẹ̀yẹ.
yo_p_2384.wav	Wọ́n ti pe gbogbo agbábọ́ọ̀lù ilẹ̀ Nàìjíríà kí wọ́n gbaradì fún ìdíje ife ẹ̀yẹ àgbáyé.
yo_p_2385.wav	Ìjọ̀ba ní tó bá di oṣù kẹwàá ọdún yìí ni àwọn yóò pe àwọn agbábọ́ọ̀lù tó wà nílẹ̀ òkèrè.
yo_p_2386.wav	Àwọn agbábọ́ọ̀lù ilẹ̀ Nàìjíríà ti yarí pé àwọn ò ní gbá bọ́ọ̀lù fún orílẹ̀ èdè Nàìjíríà.
yo_p_2387.wav	Ààrẹ Bùhárí ti ṣe ìlérí fún àwọn agbábọ́ọ̀lù pé àwọn yóò ṣe ètò owó tó tówó fún wọn.
yo_p_2388.wav	Àwọn agbábọ́ọ̀lù ọ̀hún ní kìí ṣe owó ni ó ń jẹ àwọn níyà, kí ìjọ̀ba ó di owó o wọn mú.
yo_p_2389.wav	Gbogbo ọmọ orílẹ̀ èdè yìí ti ń bẹ àwọn agbábọ́ọ̀lù tó wà ní òkè òkun fún ìdíje ife ẹ̀yẹ àgbáyé
yo_p_2390.wav	Kò sí àní-àní, orílẹ̀ èdè Nàìjíríà ò lè dé ipò kẹwàá nínú ìdíje ọ̀hún.
yo_p_2391.wav	Àwọn tó ti fi ìgbà kan gbá bọ́ọ̀lù fún orílẹ̀ èdè yìí ti pinu láti ran ìjọ̀ba lọ́wọ́ lóri ìdíje
yo_p_2392.wav	Ta ni yóò ṣe olórí àwọn agbábọ́ọ̀lù lórí i pápá?
yo_p_2393.wav	Àwọn jàǹdùkú oníbọn ti gbé àpótí ìdìbò sálọ.
yo_p_2394.wav	Ṣé wọ́n ti gbé àpótí ìdìbò sálọ?
yo_p_2395.wav	Àwọn wo ló gbójúgbójà tọ́ gbé àpótí ìdìbò?
yo_p_2396.wav	Ta ni àwọn agbófinró fi ẹ̀sùn kàn pé ó jí àpótí ìdìbò?
yo_p_2397.wav	Ǹjẹ́ àjọ tó ń rí sí ètò ìdìbò ti gbọ́ sí ìṣẹ̀lẹ̀ ọ̀hún?
yo_p_2398.wav	Ikọ̀ ọ jàǹdùkú tí àwọn ẹgbẹ́ òṣèlú alákùkọ sanwó fún ni wọ́n gbé àpótí ìdìbò.
yo_p_2399.wav	Ọ̀kan lára ọmọ ẹgbẹ́ náà ló ta àwọn agbófinró lólobó.
yo_p_2400.wav	Àjọ tó ń rí sí ètò ìdìbò ti fi ọwọ́ òfin mú adarí ẹgbẹ́ òṣèlú alákùkọ.
yo_p_2401.wav	Ọ̀mọ̀wé Yẹmí Àyìnlá ti ní ìwà tí àwọn ẹgbẹ́ òṣèlú yìí wù, kò dára fún ìdàgbàsókè ẹgbẹ́ náà.
yo_p_2402.wav	Igbákejì adarí ẹgbẹ́ ti ní òun kìlọ̀ fún wọn kí wọ́n má danwò.
yo_p_2403.wav	Akọrin kan ní orílẹ̀ èdè Kẹ́ńyà tí òkìkì rẹ̀ ṣẹ̀ṣẹ̀ kàn, ti lọ kí ààrẹ Bùhárí.
yo_p_2404.wav	Akọrin ọ̀hún ti fi ìgbà kan gbé ní orílẹ̀ èdè Nàìjíríà tí ó sì nífẹ̀ẹ́ sí ààrẹ Bùhárí.
yo_p_2405.wav	Ààrẹ Bùhárí gbàá lálejò tí wọ́n sì jìjọ ya ọ̀pọ̀lọpọ̀ àwòrán.
yo_p_2406.wav	Látàrí òkìkí i rẹ̀ tó kàn gbogbo àwọn akọrin nílẹ̀ ẹ Áfíríkà ti fẹ́ báa ṣe orin pọ̀.
yo_p_2407.wav	Àwọn akọrin ní àgbáyé ní àwọn fẹ́ mọ ẹni tó kọ orin aládùn tí àwọn ènìyàn ń gbọ́ yìí.
yo_p_2408.wav	Bí tọmọdé tàgbà ṣe ń gbọ́ orin yìí bẹ́ẹ̀ náà ni onílé àti àlejò náà ń gbọ́ ọ.
yo_p_2409.wav	Orin ọ̀hún kọ́ àwọn ènìyàn lọ́gbọ́n lọ́pọ̀lọpọ̀.
yo_p_2410.wav	Àwọn akọrin ní ìlúu Kẹ́ńyà ti fẹ́ ma jowó ọmọ olókìkí tuntun.
yo_p_2411.wav	Ààrẹ orílẹ̀ ẹ̀dẹ̀ Kẹ́ńyà ti fẹ́ kí akọrin tí òkìkí rẹ̀ ṣẹ̀ṣẹ̀ kàn
yo_p_2412.wav	Ta ni akọrin tó fẹ́ gbógun ti akọrin tí òkìkí i rẹ̀ ṣẹ̀ṣẹ̀ kàn?
yo_p_2413.wav	Wọ́n ti rọ olóyè Ọlánipẹ̀kun Ṣiyanbọ́lá lóyè.
yo_p_2414.wav	Ọ̀rọ̀ burúkú tí olóyè Ṣiyanbọ́lá sọ ló yọọ́ kúrò lórí oyè.
yo_p_2415.wav	Àwọn olóyè tó kù ní ìlú ọ̀wọ̀ ọ́ sọ pé, ìwà tí ó má ń wù sí àwa olóyè tó kù nìyẹn.
yo_p_2416.wav	Gbàgede ìlú ni Ọba ìlú ọ̀wọ̀ ti rọ̀ọ́ lóyè nítorí ó fẹ́ fi orí adé tẹlẹ̀.
yo_p_2417.wav	Ìtìjú ni Ṣiyanbọ́lá fi kúrò láàárín àwọn olóyè tó kù.
yo_p_2418.wav	Ọba ìlú Ọwọ̀ ti yan olóyè mìíràn dípò olóyè Ṣiyanbọ́lá tí wọ́n rọ̀ lóyè.
yo_p_2419.wav	Olóyè tí wọ́n ṣè fi jẹ, gba ọ̀pọ̀lọpọ̀ ẹ̀bùn lọ́wọ́ ìlú Ọ̀wọ̀.
yo_p_2420.wav	Àwọn ara ìlú Ọ̀wọ̀ kí olóyè tuntun tí Ọba ìlú Ọ̀wọ̀ ṣẹ̀ ẹ̀ fi jẹ.
yo_p_2421.wav	Ǹjẹ́ olóyè Ṣiyanbọ́lá ti wá bẹ Ọba ìlú Ọ̀wọ̀?
yo_p_2422.wav	Ìwà burúkú tí Ṣiyanbọ́lá wù ṣe àkóbá fún àwọn ẹbí i rẹ̀.
yo_p_2423.wav	Àwọn ọ̀dọ́ lórílẹ̀ èdè Nàìjíríà ti ṣe ìwọ́de pé àwọn ló kàn láti ṣètò ìjọba ìlú.
yo_p_2424.wav	Wọ́n ní kí gbogbo àwọn àgbàlagbà tó wà nínú ètò ìṣèjọba kọ́ lọ sinmi.
yo_p_2425.wav	Kò sí ìdàgbàsókè, kò sí ìlọsíwàjú ní orílẹ̀ èdè Nàìjíríà mọ́.
yo_p_2426.wav	Ààrẹ ní ọmọdé tàbi ọ̀dọ́ ò lè tukọ̀ orílẹ̀ èdè yìí nítorí ọgbọ́n àti ìrírí la fí ń tukọ̀ orílẹ̀ èdè yìí.
yo_p_2427.wav	Ẹni tó bá wọlé tẹkùn yóò fi ẹ̀jẹ̀ wẹ̀ ní ọ̀rọ̀ ìṣèjọba órílẹ̀ èdè yìí.
yo_p_2428.wav	Ẹni tó ṣe adarí àwọn ọ̀dọ́ níbi ìwọ́de ọ̀hún ni Àdìgún Adáramásingbà.
yo_p_2429.wav	Àwọn ọ̀dọ́ ní kò sí bó ti le wù kó rí, àwọn ọ̀dọ́ ní ètò ìṣèjọba kàn.
yo_p_2430.wav	Níbi ìwọ́de náà ni Àdìgún ti sọ fún gbogbo ọ̀dọ̀ pẹ́, bí a ò bá ṣe ohun tó tọ́ nísìnsìnyí ìyà yóò jẹ wá.
yo_p_2431.wav	Àdìgún Adáramásingbà tíí ṣe olórí àwọn ọ̀dọ́ ti gbáradì láti kojú gbogbo àwọn aṣèjọba lóríledè yìí.
yo_p_2432.wav	Ó tó gẹ́ẹ́ àwa ọ̀dọ́ fẹ́ gba ètò ìṣèjọba lórílẹ̀ èdè Nàìjíríà.
yo_p_2433.wav	Àwọn olórí tó ń tukọ̀ ọ wa láti ayé ìṣèjọba ológun náà lọ́ wà lórí alééfà.
yo_p_2434.wav	Orílẹ̀ èdè e Nàìjíríà gan ò le tó báyìí láyé ìṣèjọba ológun.
yo_p_2435.wav	A ti ní olóri láti ìwọ̀-oòrùn, ìlà-oòrùn, àríwá àti gúsù, gbogbo wọn pátá lọ́ ba orílẹ̀ èdè yìí jẹ́.
yo_p_2436.wav	Gbogbo ìlérí tí wọ́n ṣe fún àwọn ará ìlú ni kò mú ṣẹ.
yo_p_2437.wav	Orílẹ̀ èdè e Nàìjíríà tuntun la fẹ́, kì í ṣe ààrẹ tuntun la fẹ́.
yo_p_2438.wav	Ẹ jẹ́ ka dan àwọn ọ̀dọ́ wò, kí wọ́n lo sáà kan.
yo_p_2439.wav	Ta ni ọ̀dọ́ náà tó láyà láti bọ sí orí àlééfà ààrẹ orílẹ̀ èdè Nàìjíríà?
yo_p_2440.wav	Orílẹ̀ èdè Nàìjíríà nílò ẹni tó máa ṣiṣẹ́, tó sì máa tún un ṣe.
yo_p_2441.wav	Láti bí i ọgbọ̀n ọdún sẹ́yìn ni àwọn olóríi wa ti má ń ṣe ìlérí, tí wọn kìí mú u ṣẹ.
yo_p_2442.wav	Ka jà fún àwọn tó ń bọ̀ lẹ́yìin wa ló dára.
yo_p_2443.wav	Gómìnà ìlú Èkìtì sọ ọ́ di mímọ̀ pé àwọn ará ìlú ò lè máa dá owó fún ìjọba.
yo_p_2444.wav	Ilé ìgbìmò aṣòfin ti ìlú Èkìtì ni wọ́n rọ àwọn ará ìlú láti jọ san gbèsè.
yo_p_2445.wav	Gbogbo ará ìlú ni wọ́n kọ etí ikún sí ohun tí àwọn ilé ìgbìmò aṣòfin.
yo_p_2446.wav	Gómìnà ìlú Èkìtì yóò pe ìpàdé pẹ̀lú àwọn òṣìṣẹ́ ilé ìgbìmò aṣòfin
yo_p_2447.wav	Àwọn ilé ìgbìmò aṣòfin ti ìlú Èkìtì wọ́n ti fẹ́ máa ọ̀rọ̀ yíyá owó yìí di òótọ́.
yo_p_2448.wav	Àwọn ará ìlú ti fàáké kọ́rí pé àwọn ò ní san owó kankan fún ẹnì kankan.
yo_p_2449.wav	Ọ̀kan lára àwọn ọmọ ará ìlú Èkìtì bẹ̀rẹ̀ lọ́wọ gómìnà pé owó orí tí wọ́n gbà kí ni wọ́n fi ń ṣe.
yo_p_2450.wav	Gbogbo ohun àlùmọ́ní tó wà ní ìlú Èkìtì ni àwọn ìjọba ti tà tán.
yo_p_2451.wav	Àwọn ìjọba ti gbé ọ̀rọ̀ owó tí wọ́n yá yìí lọ sí ọ̀dọ àwọn Ọba ìlú Èkìtì fún ìpàdé.
yo_p_2452.wav	Gómìnà ìlú Èkìtì ti bẹ àwọn ará ìlú lóri ohun tí àwọn ilé ìgbìmò aṣòfin sọ.
yo_p_2453.wav	Pápá a láǹtó ni o ti máa sọ̀ tí o bá wọ ọkọ̀ tí ó ń lọ sí Àjàngbàdì.
yo_p_2454.wav	Oríṣiríṣi àràm̀barà aṣọ ni mo rà lọ́jà lánàá.
yo_p_2455.wav	Oríṣiríṣi àràm̀bádá tó bá jẹ́ pé owó wà lọ́wọ́ mi lọ́jọ́ ìnáwó náà.
yo_p_2456.wav	M̀bá ra iṣu ewùrà náà nígbà tí mo lọ sí ọjà lánàá.
yo_p_2457.wav	Ìjàbá ọkọ̀ tó ́ṣẹlẹ̀ lánàá pa ọ̀pọ̀lọpọ̀ ènìyàn tí àwọn kán sì farapa.
yo_p_2458.wav	Tí o bá ṣí aṣọ náà wà á rí kòkòrò ọlọ́yùnbẹ́rẹ́.
yo_p_2459.wav	Ẹ̀yọ̀ Adímú fẹ́ràn láti má a fi ọ̀pám̀bàtà dárà lọ́jọ́ ọdún Ẹ̀yọ̀.
yo_p_2460.wav	Ọ̀gọ̀m̀bọ̀ lorúkọ àdúgbò tí mo ti pàdé ọmọ náà.
yo_p_2461.wav	Tí mo bá ḿ bọ̀ láti ọjà lọ́la mo gbọdọ̀ ra ata sọ̀m̀bọ̀ láti fi dáná ọbẹ̀.
yo_p_2462.wav	Àwọn Gàm̀bàrí ti gba Èkó mọ́ wa lọ́wọ́ tan.
yo_p_2463.wav	Mo fẹ́ràn láti máa wọ ṣòkòtò o kẹ̀m̀bẹ̀.
yo_p_2464.wav	Bẹ̀m̀bẹ́ ọlọ́kùnrùn tún ti gbé wàhálà à rẹ̀ dé.
yo_p_2465.wav	Ilé ti màá kọ́ fún màámi gbọdọ̀ tóbi bọ̀m̀bọ̀rọ̀.
yo_p_2466.wav	Agbolé Lám̀bẹ́ ní ìlú Adénifújà ni gómìnà ìpínlẹ̀ ọ̀hún ti wá.
yo_p_2467.wav	Àjàm̀bàdì lorúkọ àlàjẹ́ ẹ rẹ̀ lásìkò èwe rẹ̀.
yo_p_2468.wav	Ṣé ọ̀jẹ̀m̀bẹ̀jẹmbẹ̀ lorúkọ tí bàbá à rẹ àti ìyá à rẹ sọ ẹ́ lọ́jọ́ ọ súná?
yo_p_2469.wav	Kí ló jẹ́ bàm̀bàrà nínu ohun tó ṣẹlẹ̀ yìí?
yo_p_2470.wav	Ilé-iṣẹ́ Bọ̀ḿbàtà ti ń ṣe oríṣiríṣi bàtà jáde.
yo_p_2471.wav	Ọlọ́run ni àràm̀barà tó ń dárà.
yo_p_2472.wav	Ṣé o ti bá mi pe Ọdúnm̀bákú?
yo_p_2473.wav	Ẹ wo bí ó ṣe tóbi bàm̀bà.
yo_p_2474.wav	Adùnḿbárìn tí ò mọ ẹni tó yẹ kó bá rìn.
yo_p_2475.wav	M̀bárí ọmọ tuntun jòjòló náà, m̀ bá yọ̀.
yo_p_2476.wav	Bí o bá dé apá ìwọ̀ oòrùn wà á rí ìlú tó ń jẹ́ Àjàm̀bàkù.
yo_p_2477.wav	Tí wọ́n bá wọ àdúgbò o Àjàm̀bàkù wà á rí àpáta tó ju àpáta Olúmọ lọ.
yo_p_2478.wav	Ṣé wọ̀m̀bílíkí ni ọrẹ́ ẹ Ṣadé ni?
yo_p_2479.wav	Wọ̀m̀bìà ni àwọn aláṣe ìjọba orílẹ̀ èdè yii.
